{
    "iri": "https://data.brno.cz/zdroj/události/2019/vinobraní",
    "název": {
        "cs": "Brněnské vinobraní",
        "en": "Brno Wine Festival"
    },
    "popis": {
        "cs": "Město Brno Vás zve na již 21. vinobraní.",
        "en": "City of Brno invites you to 21th Wine Festival."
    },
    "pořadatel": [{
        "osoba": {
            "ičo": "44992785",
            "název": "Statutární město Brno"
        }
    }],
    "umístění": [{
        "geometrie": {
            "type": "Point",
            "coordinates": [15.9915114, 48.8566829]
        },
        "adresa": {
            "adresní_místo": "https://linked.cuzk.cz/resource/ruian/adresni-misto/16135661"
        }
    }],
    "doba_trvání": [{
        "časový_interval": {
            "začátek": {
                "datum_a_čas": "2019-01-01T09:30:00+02:00"
            },
            "konec": {
                "datum_a_čas": "2019-01-07T18:00:00+02:00"
            }
        }},{
        "časový_interval": {
            "začátek": {
                "datum_a_čas": "2019-01-14T09:30:00+02:00"
            },
            "konec": {
                "datum_a_čas": "2019-01-20T18:00:00+02:00"
            }
        }
    }]
}